{"$schema":"http://json-schema.org/draft-07/schema#","properties":{"M1_task_completion":{"maximum":3,"minimum":0,"type":"integer"},"M2_factual_accuracy_proxy":{"maximum":1,"minimum":0,"type":"number"},"M2_judged":{"maximum":3,"minimum":0,"type":"integer"},"M3_decision_recovery":{"maximum":1,"minimum":0,"type":"number"},"M4_question_recovery":{"maximum":1,"minimum":0,"type":"number"},"M5_contradiction_hits":{"items":{"type":"string"},"type":"array"},"M5_contradiction_rate_per_100w":{"minimum":0,"type":"number"},"M5_judged_hits":{"items":{"type":"string"},"type":"array"},"M6_judged":{"maximum":3,"minimum":0,"type":"integer"},"M6_repeated_work_count":{"minimum":0,"type":"integer"},"M6_repeated_work_hits":{"items":{"type":"string"},"type":"array"},"condition":{"enum":["transcript","summary","world"],"type":"string"},"input_tokens":{"type":["integer","null"]},"output_chars":{"minimum":0,"type":"integer"},"output_tokens":{"type":["integer","null"]},"output_words":{"minimum":0,"type":"integer"},"prompt_chars":{"minimum":0,"type":"integer"},"prompt_words":{"minimum":0,"type":"integer"},"task":{"type":"string"}},"required":["task","condition","M2_factual_accuracy_proxy","M3_decision_recovery","M4_question_recovery","M5_contradiction_hits","M5_contradiction_rate_per_100w","M6_repeated_work_hits","M6_repeated_work_count","output_words","output_chars","prompt_words","prompt_chars"],"title":"001-state-continuation scored row","type":"object"}