[
  {
    "M2_factual_accuracy_proxy": 0.833,
    "M3_decision_recovery": 0.25,
    "M4_question_recovery": 0.667,
    "M5_contradiction_hits": [],
    "M5_contradiction_rate_per_100w": 0.0,
    "M6_repeated_work_hits": [],
    "M6_repeated_work_count": 0,
    "output_words": 182,
    "output_chars": 1209,
    "task": "task_001_vendor_selection",
    "condition": "transcript",
    "prompt_words": 785,
    "prompt_chars": 4880,
    "input_tokens": null,
    "output_tokens": null
  },
  {
    "M2_factual_accuracy_proxy": 0.5,
    "M3_decision_recovery": 0.75,
    "M4_question_recovery": 1.0,
    "M5_contradiction_hits": [],
    "M5_contradiction_rate_per_100w": 0.0,
    "M6_repeated_work_hits": [],
    "M6_repeated_work_count": 0,
    "output_words": 183,
    "output_chars": 1213,
    "task": "task_001_vendor_selection",
    "condition": "summary",
    "prompt_words": 522,
    "prompt_chars": 3401,
    "input_tokens": null,
    "output_tokens": null
  },
  {
    "M2_factual_accuracy_proxy": 0.333,
    "M3_decision_recovery": 0.75,
    "M4_question_recovery": 1.0,
    "M5_contradiction_hits": [],
    "M5_contradiction_rate_per_100w": 0.0,
    "M6_repeated_work_hits": [],
    "M6_repeated_work_count": 0,
    "output_words": 176,
    "output_chars": 1168,
    "task": "task_001_vendor_selection",
    "condition": "world",
    "prompt_words": 637,
    "prompt_chars": 4370,
    "input_tokens": null,
    "output_tokens": null
  },
  {
    "M2_factual_accuracy_proxy": 0.333,
    "M3_decision_recovery": 0.333,
    "M4_question_recovery": 1.0,
    "M5_contradiction_hits": [],
    "M5_contradiction_rate_per_100w": 0.0,
    "M6_repeated_work_hits": [],
    "M6_repeated_work_count": 0,
    "output_words": 202,
    "output_chars": 1283,
    "task": "task_002_incident_postmortem",
    "condition": "transcript",
    "prompt_words": 674,
    "prompt_chars": 4133,
    "input_tokens": null,
    "output_tokens": null
  },
  {
    "M2_factual_accuracy_proxy": 0.667,
    "M3_decision_recovery": 0.0,
    "M4_question_recovery": 1.0,
    "M5_contradiction_hits": [],
    "M5_contradiction_rate_per_100w": 0.0,
    "M6_repeated_work_hits": [],
    "M6_repeated_work_count": 0,
    "output_words": 185,
    "output_chars": 1144,
    "task": "task_002_incident_postmortem",
    "condition": "summary",
    "prompt_words": 493,
    "prompt_chars": 3039,
    "input_tokens": null,
    "output_tokens": null
  },
  {
    "M2_factual_accuracy_proxy": 1.0,
    "M3_decision_recovery": 0.333,
    "M4_question_recovery": 0.667,
    "M5_contradiction_hits": [],
    "M5_contradiction_rate_per_100w": 0.0,
    "M6_repeated_work_hits": [],
    "M6_repeated_work_count": 0,
    "output_words": 206,
    "output_chars": 1156,
    "task": "task_002_incident_postmortem",
    "condition": "world",
    "prompt_words": 566,
    "prompt_chars": 3793,
    "input_tokens": null,
    "output_tokens": null
  },
  {
    "M2_factual_accuracy_proxy": 0.8,
    "M3_decision_recovery": 0.5,
    "M4_question_recovery": 0.667,
    "M5_contradiction_hits": [],
    "M5_contradiction_rate_per_100w": 0.0,
    "M6_repeated_work_hits": [],
    "M6_repeated_work_count": 0,
    "output_words": 205,
    "output_chars": 1291,
    "task": "task_003_api_migration",
    "condition": "transcript",
    "prompt_words": 601,
    "prompt_chars": 3678,
    "input_tokens": null,
    "output_tokens": null
  },
  {
    "M2_factual_accuracy_proxy": 0.6,
    "M3_decision_recovery": 0.75,
    "M4_question_recovery": 0.667,
    "M5_contradiction_hits": [],
    "M5_contradiction_rate_per_100w": 0.0,
    "M6_repeated_work_hits": [],
    "M6_repeated_work_count": 0,
    "output_words": 167,
    "output_chars": 1101,
    "task": "task_003_api_migration",
    "condition": "summary",
    "prompt_words": 412,
    "prompt_chars": 2614,
    "input_tokens": null,
    "output_tokens": null
  },
  {
    "M2_factual_accuracy_proxy": 0.6,
    "M3_decision_recovery": 1.0,
    "M4_question_recovery": 1.0,
    "M5_contradiction_hits": [],
    "M5_contradiction_rate_per_100w": 0.0,
    "M6_repeated_work_hits": [],
    "M6_repeated_work_count": 0,
    "output_words": 186,
    "output_chars": 1191,
    "task": "task_003_api_migration",
    "condition": "world",
    "prompt_words": 495,
    "prompt_chars": 3351,
    "input_tokens": null,
    "output_tokens": null
  }
]
